{
  "name": "amazon_test",
  "base_url": "https://www.amazon.com",
  "deals_page_url": "https://www.amazon.com/gp/goldbox",
  "clearance_page_url": "",
  "product_selector": "div",
  "price_selector": ".a-price .a-offscreen",
  "title_selector": "productTitle",
  "image_selector": "img",
  "was_price_selector": ".a-text-price .a-offscreen",
  "stock_selector": "In Stock",
  "sku_pattern": "/dp/([A-Z0-9]+)",
  "api_endpoints": {},
  "rate_limit_ms": 2000,
  "requires_browser": true
}
