{
  "name": "teststore",
  "base_url": "http://127.0.0.1:18923",
  "deals_page_url": "http://127.0.0.1:18923/tallow_test_deals.html",
  "clearance_page_url": "http://127.0.0.1:18923/tallow_test_deals.html",
  "product_selector": "article",
  "price_selector": ".price",
  "title_selector": "h2",
  "image_selector": "img",
  "was_price_selector": ".was-price",
  "stock_selector": "Stock",
  "sku_pattern": "/([A-Z0-9]+)",
  "api_endpoints": {},
  "rate_limit_ms": 100,
  "requires_browser": false
}
